{"type":"config","name":"Optimize val_bpb","metricName":"val_bpb","metricUnit":"bpb","bestDirection":"lower"}
{"run":1,"commit":"f1e2d3c","metric":1.052,"metrics":{"peak_memory_mb":9800,"mfu_percent":31.2},"status":"keep","description":"baseline DEPTH=6 n_embd=384","timestamp":1751790000,"segment":0,"confidence":null}
{"run":2,"commit":"e2d3c4b","metric":1.038,"metrics":{"peak_memory_mb":10400,"mfu_percent":33.5},"status":"keep","description":"raise matrix LR 0.02->0.03","timestamp":1751790400,"segment":0,"confidence":null,"asi":{"hypothesis":"higher LR converges faster within the 5min budget","result":"clear win","next_action_hint":"push LR to 0.04, watch for divergence"}}
{"run":3,"commit":"d3c4b5a","metric":1.061,"status":"discard","description":"LR 0.03->0.05","timestamp":1751790800,"segment":0,"confidence":1.4,"asi":{"hypothesis":"even higher LR","result":"loss got noisy, worse bpb","next_action_hint":"stay at 0.03-0.04, try stretching the warmdown schedule instead"}}
{"run":4,"commit":"c4b5a69","metric":0,"status":"crash","description":"DEPTH 6->10 same batch","timestamp":1751791200,"segment":0,"confidence":1.4,"asi":{"error_details":"CUDA out of memory","next_action_hint":"if going deeper, halve DEVICE_BATCH_SIZE"}}
{"run":5,"commit":"b5a6978","metric":1.031,"metrics":{"peak_memory_mb":11900,"mfu_percent":30.1},"status":"keep","description":"DEPTH 8 with DEVICE_BATCH_SIZE 64","timestamp":1751791600,"segment":0,"confidence":2.1,"asi":{"hypothesis":"deeper model fits VRAM if batch halved","result":"best so far 1.031","next_action_hint":"try stretching the warmdown schedule"}}
