{"type":"config","name":"Optimize unit test runtime","metricName":"total_ms","metricUnit":"ms","bestDirection":"lower"}
{"run":1,"commit":"a1b2c3d","metric":5230,"status":"keep","description":"baseline","timestamp":1751800000,"segment":0,"confidence":null}
{"run":2,"commit":"b2c3d4e","metric":4890,"status":"keep","description":"parallelize test shards","timestamp":1751800600,"segment":0,"confidence":null,"asi":{"hypothesis":"tests are IO-bound, parallel shards help","next_action_hint":"tune worker count"}}
{"run":3,"commit":"c3d4e5f","metric":5105,"status":"discard","description":"increase workers 4->16","timestamp":1751801200,"segment":0,"confidence":1.2,"asi":{"hypothesis":"more workers, more speed","result":"oversubscription made it slower","next_action_hint":"try 8 workers"}}
{"run":4,"commit":"d4e5f6a","metric":0,"status":"crash","description":"lazy-import test fixtures","timestamp":1751801800,"segment":0,"confidence":1.2,"asi":{"error_details":"ImportError: circular import in conftest"}}
{"run":5,"commit":"e5f6a7b","metric":4230,"status":"keep","description":"8 workers + cached fixtures","timestamp":1751802400,"segment":0,"confidence":2.3,"asi":{"hypothesis":"8 workers is the sweet spot","result":"best run so far","next_action_hint":"try test ordering by historical duration"}}
